Accession ID,Protein Names,GO ID,GO Slim Function,Swiss-Prot Annotation,RNA-seq mapping depth,# AAs,Spectra Number,SAF,NSAF,Status,p-value
XP_003503887.1,PREDICTED: heterogeneous nuclear ribonucleoprotein L [Cricetulus griseus],GO:0003676; nucleic acid binding; Molecular Function;,binding,HNRPL_HUMAN Heterogeneous nuclear ribonucleoprotein L OS=Homo sapiens GN=HNRNPL PE=1 SV=2,148.749522,208,39,0.1875,0.001464857,1,0.03120037
XP_003513576.1,PREDICTED: multifunctional protein ADE2-like [Cricetulus griseus],GO:0004638; phosphoribosylaminoimidazole carboxylase activity; Molecular Function;,catalytic activity,PUR6_HUMAN Multifunctional protein ADE2 OS=Homo sapiens GN=PAICS PE=1 SV=3,154.667294,87,34,0.390804598,0.003053188,1,0.002969979
XP_003496437.1,PREDICTED: ubiquitin carboxyl-terminal hydrolase 7-like [Cricetulus griseus],0,#N/A,UBP7_HUMAN Ubiquitin carboxyl-terminal hydrolase 7 OS=Homo sapiens GN=USP7 PE=1 SV=2,172.299928,82,60,0.731707317,0.005716515,1,0.000279727
XP_003512044.1,"PREDICTED: exosome complex component RRP43-like, partial [Cricetulus griseus]",0,#N/A,EXOS8_MOUSE Exosome complex exonuclease RRP43 OS=Mus musculus GN=Exosc8 PE=2 SV=1,191.568531,51,14,0.274509804,0.002144627,1,0.01349227
XP_003495899.1,PREDICTED: structural maintenance of chromosomes protein 2 [Cricetulus griseus],GO:0005524; ATP binding; Molecular Function;,binding,SMC2_MOUSE Structural maintenance of chromosomes protein 2 OS=Mus musculus GN=Smc2 PE=1 SV=1,198.227295,190,55,0.289473684,0.002261534,1,0.011903553
XP_003499326.1,PREDICTED: protein phosphatase 1 regulatory subunit 7-like [Cricetulus griseus],0,#N/A,PP1R7_RAT Protein phosphatase 1 regulatory subunit 7 OS=Rattus norvegicus GN=Ppp1r7 PE=1 SV=1,299.541954,58,26,0.448275862,0.003502187,1,0.004790792
NP_001233654.1,phosphoglycerate kinase 1 [Cricetulus griseus],GO:0004618; phosphoglycerate kinase activity; Molecular Function;,signal transduction,PGK1_RAT Phosphoglycerate kinase 1 OS=Rattus norvegicus GN=Pgk1 PE=1 SV=2,327.758762,242,53,0.219008264,0.001711017,1,0.049376405
XP_003496346.1,PREDICTED: eukaryotic translation initiation factor 3 subunit B [Cricetulus griseus],0,#N/A,EIF3B_MOUSE Eukaryotic translation initiation factor 3 subunit B OS=Mus musculus GN=Eif3b PE=1 SV=1,1080.564438,62,54,0.870967742,0.006804497,1,0.002867986
,,,,,,,,,,,
,,,,,,,,,,,
